paper_id,title,year,venue,topic,category,matched_keyword,period
pvldb_2014_0022,"Combining User Interaction, Speculative Query Execution and Sampling in the DICE System.",2014,PVLDB,ML for DB,AI for Data Systems,sampling,2010-2014
pvldb_2014_0024,ConfluxDB: Multi-Master Replication for Partitioned Snapshot Isolation Databases.,2014,PVLDB,Distributed DB,Systems,replication,2010-2014
pvldb_2014_0028,Differentially Private Event Sequences over Infinite Streams.,2014,PVLDB,Streaming,Data Processing,stream,2010-2014
pvldb_2014_0029,DimmWitted: A Study of Main-Memory Statistical Analytics.,2014,PVLDB,Indexing,Storage & Access,in-memory,2010-2014
pvldb_2014_0029,DimmWitted: A Study of Main-Memory Statistical Analytics.,2014,PVLDB,Data Analytics,Applications,analytics,2010-2014
pvldb_2014_0030,Distributed Graph Simulation: Impossibility and Possibility.,2014,PVLDB,Distributed DB,Systems,distributed,2010-2014
pvldb_2014_0030,Distributed Graph Simulation: Impossibility and Possibility.,2014,PVLDB,Graph Data,Data Models,graph,2010-2014
pvldb_2014_0031,E-Store: Fine-Grained Elastic Partitioning for Distributed Transaction Processing.,2014,PVLDB,Transactions,Systems,transaction,2010-2014
pvldb_2014_0031,E-Store: Fine-Grained Elastic Partitioning for Distributed Transaction Processing.,2014,PVLDB,Distributed DB,Systems,partitioning,2010-2014
pvldb_2014_0031,E-Store: Fine-Grained Elastic Partitioning for Distributed Transaction Processing.,2014,PVLDB,Cloud DB,Systems,elastic,2010-2014
pvldb_2014_0032,Edelweiss: Automatic Storage Reclamation for Distributed Programming.,2014,PVLDB,Indexing,Storage & Access,storage,2010-2014
pvldb_2014_0032,Edelweiss: Automatic Storage Reclamation for Distributed Programming.,2014,PVLDB,Distributed DB,Systems,distributed,2010-2014
pvldb_2014_0033,Efficient Top-K SimRank-based Similarity Join.,2014,PVLDB,Query Optimization,Query Processing,join,2010-2014
pvldb_2014_0033,Efficient Top-K SimRank-based Similarity Join.,2014,PVLDB,Information Retrieval,Applications,top-k,2010-2014
pvldb_2014_0035,Error-bounded Sampling for Analytics on Big Sparse Data.,2014,PVLDB,Data Analytics,Applications,analytics,2010-2014
pvldb_2014_0035,Error-bounded Sampling for Analytics on Big Sparse Data.,2014,PVLDB,ML for DB,AI for Data Systems,sampling,2010-2014
pvldb_2014_0036,Execution Primitives for Scalable Joins and Aggregations in Map Reduce.,2014,PVLDB,Query Optimization,Query Processing,join,2010-2014
pvldb_2014_0038,Fast Failure Recovery in Distributed Graph Processing Systems.,2014,PVLDB,Transactions,Systems,recovery,2010-2014
pvldb_2014_0038,Fast Failure Recovery in Distributed Graph Processing Systems.,2014,PVLDB,Distributed DB,Systems,distributed,2010-2014
pvldb_2014_0038,Fast Failure Recovery in Distributed Graph Processing Systems.,2014,PVLDB,Graph Data,Data Models,graph,2010-2014
pvldb_2014_0039,Fatman: Cost-saving and reliable archival storage based on volunteer resources.,2014,PVLDB,Indexing,Storage & Access,storage,2010-2014
pvldb_2014_0040,Finding the Cost-Optimal Path with Time Constraint over Time-Dependent Graphs.,2014,PVLDB,Graph Data,Data Models,graph,2010-2014
pvldb_2014_0043,GRAMI: Frequent Subgraph and Pattern Mining in a Single Large Graph.,2014,PVLDB,Graph Data,Data Models,graph,2010-2014
pvldb_2014_0044,Generating Top-k Packages via Preference Elicitation.,2014,PVLDB,Information Retrieval,Applications,top-k,2010-2014
pvldb_2014_0045,Getting Your Big Data Priorities Straight: A Demonstration of Priority-based QoS using Social-network-driven Stock Recommendation.,2014,PVLDB,Data Analytics,Applications,big data,2010-2014
pvldb_2014_0046,HDBTracker: Monitoring the Aggregates On Dynamic Hidden Web Databases.,2014,PVLDB,Information Retrieval,Applications,web,2010-2014
pvldb_2014_0047,Hop Doubling Label Indexing for Point-to-Point Distance Querying on Scale-Free Networks.,2014,PVLDB,Query Optimization,Query Processing,querying,2010-2014
pvldb_2014_0047,Hop Doubling Label Indexing for Point-to-Point Distance Querying on Scale-Free Networks.,2014,PVLDB,Indexing,Storage & Access,indexing,2010-2014
pvldb_2014_0049,Joins on Encoded and Partitioned Data.,2014,PVLDB,Query Optimization,Query Processing,join,2010-2014
pvldb_2014_0050,Large Scale Real-time Ridesharing with Service Guarantee on Road Networks.,2014,PVLDB,Graph Data,Data Models,road network,2010-2014
pvldb_2014_0051,Large-Scale Distributed Graph Computing Systems: An Experimental Evaluation.,2014,PVLDB,Distributed DB,Systems,distributed,2010-2014
pvldb_2014_0051,Large-Scale Distributed Graph Computing Systems: An Experimental Evaluation.,2014,PVLDB,Graph Data,Data Models,graph,2010-2014
pvldb_2014_0051,Large-Scale Distributed Graph Computing Systems: An Experimental Evaluation.,2014,PVLDB,Data Analytics,Applications,evaluation,2010-2014
pvldb_2014_0052,M4: A Visualization-Oriented Time Series Data Aggregation.,2014,PVLDB,Spatial / Temporal,Specialized Data,time series,2010-2014
pvldb_2014_0053,MRTuner: A Toolkit to Enable Holistic Optimization for MapReduce Jobs.,2014,PVLDB,Distributed DB,Systems,mapreduce,2010-2014
pvldb_2014_0054,MaaT: Effective and scalable coordination of distributed transactions in the cloud.,2014,PVLDB,Transactions,Systems,transaction,2010-2014
pvldb_2014_0054,MaaT: Effective and scalable coordination of distributed transactions in the cloud.,2014,PVLDB,Distributed DB,Systems,distributed transaction,2010-2014
pvldb_2014_0054,MaaT: Effective and scalable coordination of distributed transactions in the cloud.,2014,PVLDB,Cloud DB,Systems,cloud,2010-2014
pvldb_2014_0055,Matching Titles with Cross Title Web-Search Enrichment and Community Detection.,2014,PVLDB,Graph Data,Data Models,community detection,2010-2014
pvldb_2014_0055,Matching Titles with Cross Title Web-Search Enrichment and Community Detection.,2014,PVLDB,ML for DB,AI for Data Systems,detection,2010-2014
pvldb_2014_0057,Multi-Objective Parametric Query Optimization.,2014,PVLDB,Query Optimization,Query Processing,query optimization,2010-2014
pvldb_2014_0062,Ontology Assisted Crowd Mining.,2014,PVLDB,RDF / Semantic Web,Data Models,ontology,2010-2014
pvldb_2014_0062,Ontology Assisted Crowd Mining.,2014,PVLDB,Crowdsourcing,Applications,crowd,2010-2014
pvldb_2014_0063,Optimizing Join Enumeration in Transformation-based Query Optimizers.,2014,PVLDB,Query Optimization,Query Processing,query optimizer,2010-2014
pvldb_2014_0064,Optimizing the Chase: Scalable Data Integration under Constraints.,2014,PVLDB,Data Integration,Data Processing,data integration,2010-2014
pvldb_2014_0065,PRESS: A Novel Framework of Trajectory Compression in Road Networks.,2014,PVLDB,Graph Data,Data Models,road network,2010-2014
pvldb_2014_0065,PRESS: A Novel Framework of Trajectory Compression in Road Networks.,2014,PVLDB,Spatial / Temporal,Specialized Data,trajectory,2010-2014
pvldb_2014_0067,Pregelix: Big(ger) Graph Analytics on a Dataflow Engine.,2014,PVLDB,Graph Data,Data Models,graph,2010-2014
pvldb_2014_0067,Pregelix: Big(ger) Graph Analytics on a Dataflow Engine.,2014,PVLDB,Data Analytics,Applications,analytics,2010-2014
pvldb_2014_0070,Progressive Approach to Relational Entity Resolution.,2014,PVLDB,Data Integration,Data Processing,entity resolution,2010-2014
pvldb_2014_0071,QUEST: An Exploratory Approach to Robust Query Processing.,2014,PVLDB,Query Optimization,Query Processing,query processing,2010-2014
pvldb_2014_0073,RASP-QS: Efficient and Confidential Query Services in the Cloud.,2014,PVLDB,Cloud DB,Systems,cloud,2010-2014
pvldb_2014_0074,Rank Join Queries in NoSQL Databases.,2014,PVLDB,Query Optimization,Query Processing,join,2010-2014
pvldb_2014_0075,Real-Time Twitter Recommendation: Online Motif Detection in Large Dynamic Graphs.,2014,PVLDB,Graph Data,Data Models,graph,2010-2014
pvldb_2014_0075,Real-Time Twitter Recommendation: Online Motif Detection in Large Dynamic Graphs.,2014,PVLDB,ML for DB,AI for Data Systems,detection,2010-2014
pvldb_2014_0076,Realization of the Low Cost and High Performance MySQL Cloud Database.,2014,PVLDB,Cloud DB,Systems,cloud,2010-2014
pvldb_2014_0076,Realization of the Low Cost and High Performance MySQL Cloud Database.,2014,PVLDB,Data Analytics,Applications,performance,2010-2014
pvldb_2014_0078,Resource Bricolage for Parallel Database Systems.,2014,PVLDB,Distributed DB,Systems,parallel,2010-2014
pvldb_2014_0080,S-Store: A Streaming NewSQL System for Big Velocity Applications.,2014,PVLDB,Streaming,Data Processing,streaming,2010-2014
pvldb_2014_0081,SK-LSH: An Efficient Index Structure for Approximate Nearest Neighbor Search.,2014,PVLDB,Indexing,Storage & Access,index,2010-2014
pvldb_2014_0081,SK-LSH: An Efficient Index Structure for Approximate Nearest Neighbor Search.,2014,PVLDB,Information Retrieval,Applications,search,2010-2014
pvldb_2014_0081,SK-LSH: An Efficient Index Structure for Approximate Nearest Neighbor Search.,2014,PVLDB,Vector Search,AI for Data Systems,approximate nearest neighbor,2010-2014
pvldb_2014_0083,SPIRE: Supporting Parameter-Driven Interactive Rule Mining and Exploration.,2014,PVLDB,Data Analytics,Applications,interactive,2010-2014
pvldb_2014_0084,SQL/AA: Executing SQL on an Asymmetric Architecture.,2014,PVLDB,Query Optimization,Query Processing,sql,2010-2014
pvldb_2014_0085,STMaker - A System to Make Sense of Trajectory Data.,2014,PVLDB,Spatial / Temporal,Specialized Data,trajectory,2010-2014
pvldb_2014_0086,Scalable and Adaptive Online Joins.,2014,PVLDB,Query Optimization,Query Processing,join,2010-2014
pvldb_2014_0087,Selectivity Estimation on Streaming Spatio-Textual Data Using Local Correlations.,2014,PVLDB,Streaming,Data Processing,streaming,2010-2014
pvldb_2014_0087,Selectivity Estimation on Streaming Spatio-Textual Data Using Local Correlations.,2014,PVLDB,ML for DB,AI for Data Systems,estimation,2010-2014
pvldb_2014_0090,Similarity Search for Scientific Workflows.,2014,PVLDB,Information Retrieval,Applications,search,2010-2014
pvldb_2014_0090,Similarity Search for Scientific Workflows.,2014,PVLDB,Vector Search,AI for Data Systems,similarity search,2010-2014
pvldb_2014_0091,Spatial Joins in Main Memory: Implementation Matters!,2014,PVLDB,Query Optimization,Query Processing,join,2010-2014
pvldb_2014_0091,Spatial Joins in Main Memory: Implementation Matters!,2014,PVLDB,Indexing,Storage & Access,main memory,2010-2014
pvldb_2014_0091,Spatial Joins in Main Memory: Implementation Matters!,2014,PVLDB,Spatial / Temporal,Specialized Data,spatial,2010-2014
pvldb_2014_0092,Storage Management in AsterixDB.,2014,PVLDB,Indexing,Storage & Access,storage,2010-2014
pvldb_2014_0093,Storing and Querying Tree-Structured Records in Dremel.,2014,PVLDB,Query Optimization,Query Processing,querying,2010-2014
pvldb_2014_0094,String Similarity Joins: An Experimental Evaluation.,2014,PVLDB,Query Optimization,Query Processing,join,2010-2014
pvldb_2014_0094,String Similarity Joins: An Experimental Evaluation.,2014,PVLDB,Data Analytics,Applications,evaluation,2010-2014
pvldb_2014_0098,Top-k Nearest Neighbor Search In Uncertain Data Series.,2014,PVLDB,Information Retrieval,Applications,top-k,2010-2014
pvldb_2014_0099,Tracking Entities in the Dynamic World: A Fast Algorithm for Matching Temporal Records.,2014,PVLDB,Spatial / Temporal,Specialized Data,temporal,2010-2014
pvldb_2014_0100,Trajectory Simplification: On Minimizing the Direction-based Error.,2014,PVLDB,Spatial / Temporal,Specialized Data,trajectory,2010-2014
pvldb_2014_0101,Uncertainty Aware Query Execution Time Prediction.,2014,PVLDB,Query Optimization,Query Processing,execution,2010-2014
pvldb_2014_0102,VERTEXICA: Your Relational Friend for Graph Analytics!,2014,PVLDB,Graph Data,Data Models,graph,2010-2014
pvldb_2014_0102,VERTEXICA: Your Relational Friend for Graph Analytics!,2014,PVLDB,Data Analytics,Applications,analytics,2010-2014
pvldb_2014_0105,Workload Matters: Why RDF Databases Need a New Design.,2014,PVLDB,RDF / Semantic Web,Data Models,rdf,2010-2014
pvldb_2014_0105,Workload Matters: Why RDF Databases Need a New Design.,2014,PVLDB,Data Analytics,Applications,workload,2010-2014
pvldb_2014_0106,yzBigData: Provisioning Customizable Solution for Big Data.,2014,PVLDB,Data Analytics,Applications,big data,2010-2014
pvldb_2015_0001,A Demonstration of TripleProv: Tracking and Querying Provenance over Web Data.,2015,PVLDB,Query Optimization,Query Processing,querying,2015-2019
pvldb_2015_0001,A Demonstration of TripleProv: Tracking and Querying Provenance over Web Data.,2015,PVLDB,Information Retrieval,Applications,web,2015-2019
pvldb_2015_0002,A Framework for Clustering Uncertain Data.,2015,PVLDB,ML for DB,AI for Data Systems,clustering,2015-2019
pvldb_2015_0003,A Scalable Distributed Graph Partitioner.,2015,PVLDB,Distributed DB,Systems,distributed,2015-2019
pvldb_2015_0003,A Scalable Distributed Graph Partitioner.,2015,PVLDB,Graph Data,Data Models,graph,2015-2019
pvldb_2015_0004,A Scalable Search Engine for Mass Storage Smart Objects.,2015,PVLDB,Indexing,Storage & Access,storage,2015-2019
pvldb_2015_0004,A Scalable Search Engine for Mass Storage Smart Objects.,2015,PVLDB,Information Retrieval,Applications,search engine,2015-2019
pvldb_2015_0007,AIDE: An Automatic User Navigation System for Interactive Data Exploration.,2015,PVLDB,Data Analytics,Applications,interactive,2015-2019
pvldb_2015_0008,ALID: Scalable Dominant Cluster Detection.,2015,PVLDB,ML for DB,AI for Data Systems,detection,2015-2019
pvldb_2015_0009,AQWA: Adaptive Query-Workload-Aware Partitioning of Big Spatial Data.,2015,PVLDB,Distributed DB,Systems,partitioning,2015-2019
pvldb_2015_0009,AQWA: Adaptive Query-Workload-Aware Partitioning of Big Spatial Data.,2015,PVLDB,Spatial / Temporal,Specialized Data,spatial,2015-2019
pvldb_2015_0010,Annotating Database Schemas to Help Enterprise Search.,2015,PVLDB,Information Retrieval,Applications,search,2015-2019
pvldb_2015_0011,Approximate Closest Community Search in Networks.,2015,PVLDB,Graph Data,Data Models,community search,2015-2019
pvldb_2015_0011,Approximate Closest Community Search in Networks.,2015,PVLDB,Information Retrieval,Applications,search,2015-2019
pvldb_2015_0012,Argonaut: Macrotask Crowdsourcing for Complex Data Processing.,2015,PVLDB,Crowdsourcing,Applications,crowdsourcing,2015-2019
pvldb_2015_0013,Association Rules with Graph Patterns.,2015,PVLDB,Graph Data,Data Models,graph,2015-2019
pvldb_2015_0014,Bonding Vertex Sets Over Distributed Graph: A Betweenness Aware Approach.,2015,PVLDB,Distributed DB,Systems,distributed,2015-2019
pvldb_2015_0014,Bonding Vertex Sets Over Distributed Graph: A Betweenness Aware Approach.,2015,PVLDB,Graph Data,Data Models,graph,2015-2019
pvldb_2015_0015,Clash of the Titans: MapReduce vs. Spark for Large Scale Data Analytics.,2015,PVLDB,Distributed DB,Systems,mapreduce,2015-2019
pvldb_2015_0015,Clash of the Titans: MapReduce vs. Spark for Large Scale Data Analytics.,2015,PVLDB,Data Analytics,Applications,analytics,2015-2019
pvldb_2015_0016,Combining Quantitative and Logical Data Cleaning.,2015,PVLDB,Data Integration,Data Processing,data cleaning,2015-2019
pvldb_2015_0017,Compaction Management in Distributed Key-Value Datastores.,2015,PVLDB,Distributed DB,Systems,distributed,2015-2019
pvldb_2015_0018,Compressed Spatial Hierarchical Bitmap (cSHB) Indexes for Efficiently Processing Spatial Range Query Workloads.,2015,PVLDB,Indexing,Storage & Access,index,2015-2019
pvldb_2015_0018,Compressed Spatial Hierarchical Bitmap (cSHB) Indexes for Efficiently Processing Spatial Range Query Workloads.,2015,PVLDB,Data Analytics,Applications,workload,2015-2019
pvldb_2015_0018,Compressed Spatial Hierarchical Bitmap (cSHB) Indexes for Efficiently Processing Spatial Range Query Workloads.,2015,PVLDB,Spatial / Temporal,Specialized Data,spatial,2015-2019
pvldb_2015_0019,ConfSeer: Leveraging Customer Support Knowledge Bases for Automated Misconfiguration Detection.,2015,PVLDB,Graph Data,Data Models,knowledge base,2015-2019
pvldb_2015_0019,ConfSeer: Leveraging Customer Support Knowledge Bases for Automated Misconfiguration Detection.,2015,PVLDB,ML for DB,AI for Data Systems,detection,2015-2019
pvldb_2015_0020,Cumulon: Matrix-Based Data Analytics in the Cloud with Spot Instances.,2015,PVLDB,Cloud DB,Systems,cloud,2015-2019
pvldb_2015_0020,Cumulon: Matrix-Based Data Analytics in the Cloud with Spot Instances.,2015,PVLDB,Data Analytics,Applications,analytics,2015-2019
pvldb_2015_0021,D2P: Distance-Based Differential Privacy in Recommenders.,2015,PVLDB,Privacy / Security,Trust,privacy,2015-2019
pvldb_2015_0022,DAQ: A New Paradigm for Approximate Query Processing.,2015,PVLDB,Query Optimization,Query Processing,query processing,2015-2019
pvldb_2015_0023,DBSeer: Pain-free Database Administration through Workload Intelligence.,2015,PVLDB,Data Analytics,Applications,workload,2015-2019
pvldb_2015_0024,DEXTER: Large-Scale Discovery and Extraction of Product Specifications on the Web.,2015,PVLDB,Data Analytics,Applications,large-scale,2015-2019
pvldb_2015_0024,DEXTER: Large-Scale Discovery and Extraction of Product Specifications on the Web.,2015,PVLDB,Information Retrieval,Applications,web,2015-2019
pvldb_2015_0025,DREAM: Distributed RDF Engine with Adaptive Query Planner and Minimal Communication.,2015,PVLDB,Distributed DB,Systems,distributed,2015-2019
pvldb_2015_0025,DREAM: Distributed RDF Engine with Adaptive Query Planner and Minimal Communication.,2015,PVLDB,RDF / Semantic Web,Data Models,rdf,2015-2019
pvldb_2015_0029,Efficient Evaluation of Object-Centric Exploration Queries for Visualization.,2015,PVLDB,Data Analytics,Applications,evaluation,2015-2019
pvldb_2015_0030,Efficient Processing of Window Functions in Analytical SQL Queries.,2015,PVLDB,Query Optimization,Query Processing,sql,2015-2019
pvldb_2015_0032,Evaluating SPARQL Queries on Massive RDF Datasets.,2015,PVLDB,RDF / Semantic Web,Data Models,rdf,2015-2019
pvldb_2015_0033,Exploiting Vertex Relationships in Speeding up Subgraph Isomorphism over Large Graphs.,2015,PVLDB,Graph Data,Data Models,graph,2015-2019
pvldb_2015_0039,Functional Dependency Discovery: An Experimental Evaluation of Seven Algorithms.,2015,PVLDB,Data Integration,Data Processing,functional dependency,2015-2019
pvldb_2015_0039,Functional Dependency Discovery: An Experimental Evaluation of Seven Algorithms.,2015,PVLDB,Data Analytics,Applications,evaluation,2015-2019
pvldb_2015_0040,Fuzzy Joins in MapReduce: An Experimental Study.,2015,PVLDB,Query Optimization,Query Processing,join,2015-2019
pvldb_2015_0040,Fuzzy Joins in MapReduce: An Experimental Study.,2015,PVLDB,Distributed DB,Systems,mapreduce,2015-2019
pvldb_2015_0041,General Incremental Sliding-Window Aggregation.,2015,PVLDB,Streaming,Data Processing,window aggregation,2015-2019
pvldb_2015_0043,"Gorilla: A Fast, Scalable, In-Memory Time Series Database.",2015,PVLDB,Indexing,Storage & Access,in-memory,2015-2019
pvldb_2015_0043,"Gorilla: A Fast, Scalable, In-Memory Time Series Database.",2015,PVLDB,Spatial / Temporal,Specialized Data,time series,2015-2019
pvldb_2015_0044,GraphTwist: Fast Iterative Graph Computation with Two-tier Optimizations.,2015,PVLDB,Graph Data,Data Models,graph,2015-2019
pvldb_2015_0045,Improving Main Memory Hash Joins on Intel Xeon Phi Processors: An Experimental Approach.,2015,PVLDB,Query Optimization,Query Processing,join,2015-2019
pvldb_2015_0045,Improving Main Memory Hash Joins on Intel Xeon Phi Processors: An Experimental Approach.,2015,PVLDB,Indexing,Storage & Access,main memory,2015-2019
pvldb_2015_0046,Incremental Knowledge Base Construction Using DeepDive.,2015,PVLDB,Graph Data,Data Models,knowledge base,2015-2019
pvldb_2015_0047,JetScope: Reliable and Interactive Analytics at Cloud Scale.,2015,PVLDB,Cloud DB,Systems,cloud,2015-2019
pvldb_2015_0047,JetScope: Reliable and Interactive Analytics at Cloud Scale.,2015,PVLDB,Data Analytics,Applications,analytics,2015-2019
pvldb_2015_0048,Knowledge-Based Trust: Estimating the Trustworthiness of Web Sources.,2015,PVLDB,Information Retrieval,Applications,web,2015-2019
pvldb_2015_0049,Learning User Preferences By Adaptive Pairwise Comparison.,2015,PVLDB,ML for DB,AI for Data Systems,learning,2015-2019
pvldb_2015_0050,Lenses: An On-Demand Approach to ETL.,2015,PVLDB,Data Integration,Data Processing,etl,2015-2019
pvldb_2015_0055,Mindtagger: A Demonstration of Data Labeling in Knowledge Base Construction.,2015,PVLDB,Graph Data,Data Models,knowledge base,2015-2019
pvldb_2015_0056,Monitoring Distributed Streams using Convex Decompositions.,2015,PVLDB,Distributed DB,Systems,distributed,2015-2019
pvldb_2015_0056,Monitoring Distributed Streams using Convex Decompositions.,2015,PVLDB,Streaming,Data Processing,stream,2015-2019
pvldb_2015_0059,On the Surprising Difficulty of Simple Things: the Case of Radix Partitioning.,2015,PVLDB,Distributed DB,Systems,partitioning,2015-2019
pvldb_2015_0060,Online Topic-Aware Influence Maximization.,2015,PVLDB,Graph Data,Data Models,influence maximization,2015-2019
pvldb_2015_0061,Optimal Enumeration: Efficient Top-k Tree Matching.,2015,PVLDB,Information Retrieval,Applications,top-k,2015-2019
pvldb_2015_0063,PARADIS: An Efficient Parallel Algorithm for In-place Radix Sort.,2015,PVLDB,Distributed DB,Systems,parallel,2015-2019
pvldb_2015_0064,PIXIDA: Optimizing Data Parallel Jobs in Wide-Area Data Analytics.,2015,PVLDB,Distributed DB,Systems,parallel,2015-2019
pvldb_2015_0064,PIXIDA: Optimizing Data Parallel Jobs in Wide-Area Data Analytics.,2015,PVLDB,Data Analytics,Applications,analytics,2015-2019
pvldb_2015_0065,PRISM: Concept-preserving Summarization of Top-K Social Image Search Results.,2015,PVLDB,Information Retrieval,Applications,top-k,2015-2019
pvldb_2015_0066,Performance and Scalability of Indexed Subgraph Query Processing Methods.,2015,PVLDB,Query Optimization,Query Processing,query processing,2015-2019
pvldb_2015_0066,Performance and Scalability of Indexed Subgraph Query Processing Methods.,2015,PVLDB,Graph Data,Data Models,graph query,2015-2019
pvldb_2015_0066,Performance and Scalability of Indexed Subgraph Query Processing Methods.,2015,PVLDB,Data Analytics,Applications,performance,2015-2019
pvldb_2015_0067,Perseus: An Interactive Large-Scale Graph Mining and Visualization Tool.,2015,PVLDB,Graph Data,Data Models,graph,2015-2019
pvldb_2015_0067,Perseus: An Interactive Large-Scale Graph Mining and Visualization Tool.,2015,PVLDB,Data Analytics,Applications,interactive,2015-2019
pvldb_2015_0069,Privacy Implications of Database Ranking.,2015,PVLDB,Information Retrieval,Applications,ranking,2015-2019
pvldb_2015_0069,Privacy Implications of Database Ranking.,2015,PVLDB,Privacy / Security,Trust,privacy,2015-2019
pvldb_2015_0070,"Provenance for SQL through Abstract Interpretation: Value-less, but Worthwhile.",2015,PVLDB,Query Optimization,Query Processing,sql,2015-2019
pvldb_2015_0071,QOCO: A Query Oriented Data Cleaning System with Oracles.,2015,PVLDB,Data Integration,Data Processing,data cleaning,2015-2019
pvldb_2015_0072,Query-Aware Locality-Sensitive Hashing for Approximate Nearest Neighbor Search.,2015,PVLDB,Information Retrieval,Applications,search,2015-2019
pvldb_2015_0072,Query-Aware Locality-Sensitive Hashing for Approximate Nearest Neighbor Search.,2015,PVLDB,Vector Search,AI for Data Systems,approximate nearest neighbor,2015-2019
pvldb_2015_0073,Querying with Access Patterns and Integrity Constraints.,2015,PVLDB,Query Optimization,Query Processing,querying,2015-2019
pvldb_2015_0074,Rapid Sampling for Visualizations with Ordering Guarantees.,2015,PVLDB,ML for DB,AI for Data Systems,sampling,2015-2019
pvldb_2015_0075,Real-Time Analytical Processing with SQL Server.,2015,PVLDB,Query Optimization,Query Processing,sql,2015-2019
pvldb_2015_0076,Real-time Targeted Influence Maximization for Online Advertisements.,2015,PVLDB,Graph Data,Data Models,influence maximization,2015-2019
pvldb_2015_0077,Robust Local Community Detection: On Free Rider Effect and Its Elimination.,2015,PVLDB,Graph Data,Data Models,community detection,2015-2019
pvldb_2015_0077,Robust Local Community Detection: On Free Rider Effect and Its Elimination.,2015,PVLDB,ML for DB,AI for Data Systems,detection,2015-2019
pvldb_2015_0078,SAASFEE: Scalable Scientific Workflow Execution Engine.,2015,PVLDB,Query Optimization,Query Processing,execution,2015-2019
pvldb_2015_0079,SEEDB: Efficient Data-Driven Visualization Recommendations to Support Visual Analytics.,2015,PVLDB,Data Analytics,Applications,analytics,2015-2019
pvldb_2015_0080,SPARTex: A Vertex-Centric Framework for RDF Data Analytics.,2015,PVLDB,RDF / Semantic Web,Data Models,rdf,2015-2019
pvldb_2015_0080,SPARTex: A Vertex-Centric Framework for RDF Data Analytics.,2015,PVLDB,Data Analytics,Applications,analytics,2015-2019
pvldb_2015_0081,Scaling Similarity Joins over Tree-Structured Data.,2015,PVLDB,Query Optimization,Query Processing,join,2015-2019
pvldb_2015_0082,Scaling Spark in the Real World: Performance and Usability.,2015,PVLDB,Distributed DB,Systems,spark,2015-2019
pvldb_2015_0082,Scaling Spark in the Real World: Performance and Usability.,2015,PVLDB,Data Analytics,Applications,performance,2015-2019
pvldb_2015_0083,Scaling Up Concurrent Main-Memory Column-Store Scans: Towards Adaptive NUMA-aware Data and Task Placement.,2015,PVLDB,Indexing,Storage & Access,in-memory,2015-2019
pvldb_2015_0085,Searchlight: Enabling Integrated Search and Exploration over Large Multidimensional Data.,2015,PVLDB,Information Retrieval,Applications,search,2015-2019
pvldb_2015_0086,Shared Execution of Recurring Workloads in MapReduce.,2015,PVLDB,Query Optimization,Query Processing,execution,2015-2019
pvldb_2015_0086,Shared Execution of Recurring Workloads in MapReduce.,2015,PVLDB,Distributed DB,Systems,mapreduce,2015-2019
pvldb_2015_0086,Shared Execution of Recurring Workloads in MapReduce.,2015,PVLDB,Data Analytics,Applications,workload,2015-2019
