paper_id,title,year,venue,topic,category,matched_keyword,period
sigmod_2016_0026,Elastic Pipelining in an In-Memory Database Cluster.,2016,SIGMOD,Cloud DB,Systems,elastic,2015-2019
sigmod_2016_0027,EmptyHeaded: A Relational Engine for Graph Processing.,2016,SIGMOD,Graph Data,Data Models,graph,2015-2019
sigmod_2016_0032,FluxQuery: An Execution Framework for Highly Interactive Query Workloads.,2016,SIGMOD,Query Optimization,Query Processing,execution,2015-2019
sigmod_2016_0032,FluxQuery: An Execution Framework for Highly Interactive Query Workloads.,2016,SIGMOD,Data Analytics,Applications,workload,2015-2019
sigmod_2016_0033,GTS: A Fast and Scalable Graph Processing Method based on Streaming Topology to GPUs.,2016,SIGMOD,Graph Data,Data Models,graph,2015-2019
sigmod_2016_0033,GTS: A Fast and Scalable Graph Processing Method based on Streaming Topology to GPUs.,2016,SIGMOD,Streaming,Data Processing,streaming,2015-2019
sigmod_2016_0034,Generating Preview Tables for Entity Graphs.,2016,SIGMOD,Graph Data,Data Models,graph,2015-2019
sigmod_2016_0036,Graph Summarization for Geo-correlated Trends Detection in Social Networks.,2016,SIGMOD,Graph Data,Data Models,graph,2015-2019
sigmod_2016_0036,Graph Summarization for Geo-correlated Trends Detection in Social Networks.,2016,SIGMOD,ML for DB,AI for Data Systems,detection,2015-2019
sigmod_2016_0038,Hybrid Garbage Collection for Multi-Version Concurrency Control in SAP HANA.,2016,SIGMOD,Transactions,Systems,concurrency control,2015-2019
sigmod_2016_0039,Integer programming approach for directed minimum spanning tree problem on temporal graphs.,2016,SIGMOD,Graph Data,Data Models,graph,2015-2019
sigmod_2016_0039,Integer programming approach for directed minimum spanning tree problem on temporal graphs.,2016,SIGMOD,Spatial / Temporal,Specialized Data,temporal,2015-2019
sigmod_2016_0040,Interactive Search and Exploration of Waveform Data with Searchlight.,2016,SIGMOD,Data Analytics,Applications,interactive,2015-2019
sigmod_2016_0040,Interactive Search and Exploration of Waveform Data with Searchlight.,2016,SIGMOD,Information Retrieval,Applications,search,2015-2019
sigmod_2016_0041,Interactive and Deterministic Data Cleaning.,2016,SIGMOD,Data Integration,Data Processing,data cleaning,2015-2019
sigmod_2016_0041,Interactive and Deterministic Data Cleaning.,2016,SIGMOD,Data Analytics,Applications,interactive,2015-2019
sigmod_2016_0042,Interactive online learning for clinical entity recognition.,2016,SIGMOD,Data Analytics,Applications,interactive,2015-2019
sigmod_2016_0042,Interactive online learning for clinical entity recognition.,2016,SIGMOD,ML for DB,AI for Data Systems,learning,2015-2019
sigmod_2016_0043,Introduction to Spark 2.0 for Database Researchers.,2016,SIGMOD,Distributed DB,Systems,spark,2015-2019
sigmod_2016_0044,Learning Linear Regression Models over Factorized Joins.,2016,SIGMOD,Query Optimization,Query Processing,join,2015-2019
sigmod_2016_0044,Learning Linear Regression Models over Factorized Joins.,2016,SIGMOD,ML for DB,AI for Data Systems,learning,2015-2019
sigmod_2016_0045,Local Similarity Search for Unstructured Text.,2016,SIGMOD,Information Retrieval,Applications,search,2015-2019
sigmod_2016_0045,Local Similarity Search for Unstructured Text.,2016,SIGMOD,Vector Search,AI for Data Systems,similarity search,2015-2019
sigmod_2016_0046,M3: Scaling Up Machine Learning via Memory Mapping.,2016,SIGMOD,ML for DB,AI for Data Systems,machine learning,2015-2019
sigmod_2016_0048,Micro-architectural Analysis of In-memory OLTP.,2016,SIGMOD,Indexing,Storage & Access,in-memory,2015-2019
sigmod_2016_0048,Micro-architectural Analysis of In-memory OLTP.,2016,SIGMOD,Data Analytics,Applications,analysis,2015-2019
sigmod_2016_0049,ModelDB: a system for machine learning model management.,2016,SIGMOD,ML for DB,AI for Data Systems,machine learning,2015-2019
sigmod_2016_0050,NScaleSpark: subgraph-centric graph analytics on Apache Spark.,2016,SIGMOD,Distributed DB,Systems,spark,2015-2019
sigmod_2016_0050,NScaleSpark: subgraph-centric graph analytics on Apache Spark.,2016,SIGMOD,Graph Data,Data Models,graph,2015-2019
sigmod_2016_0050,NScaleSpark: subgraph-centric graph analytics on Apache Spark.,2016,SIGMOD,Data Analytics,Applications,analytics,2015-2019
sigmod_2016_0051,On exploring efficient shuffle design for in-memory MapReduce.,2016,SIGMOD,Indexing,Storage & Access,in-memory,2015-2019
sigmod_2016_0051,On exploring efficient shuffle design for in-memory MapReduce.,2016,SIGMOD,Distributed DB,Systems,mapreduce,2015-2019
sigmod_2016_0052,Ontology-Based Integration of Streaming and Static Relational Data with Optique.,2016,SIGMOD,Streaming,Data Processing,streaming,2015-2019
sigmod_2016_0053,Operator and Query Progress Estimation in Microsoft SQL Server Live Query Statistics.,2016,SIGMOD,Query Optimization,Query Processing,sql,2015-2019
sigmod_2016_0053,Operator and Query Progress Estimation in Microsoft SQL Server Live Query Statistics.,2016,SIGMOD,ML for DB,AI for Data Systems,estimation,2015-2019
sigmod_2016_0055,PFunk-H: approximate query processing using perceptual models.,2016,SIGMOD,Query Optimization,Query Processing,query processing,2015-2019
sigmod_2016_0057,PerfEnforce Demonstration: Data Analytics with Performance Guarantees.,2016,SIGMOD,Data Analytics,Applications,analytics,2015-2019
sigmod_2016_0058,Potential and Pitfalls of Domain-Specific Information Extraction at Web Scale.,2016,SIGMOD,Data Integration,Data Processing,information extraction,2015-2019
sigmod_2016_0058,Potential and Pitfalls of Domain-Specific Information Extraction at Web Scale.,2016,SIGMOD,Information Retrieval,Applications,web,2015-2019
sigmod_2016_0059,Practical Private Range Search Revisited.,2016,SIGMOD,Information Retrieval,Applications,search,2015-2019
sigmod_2016_0061,PrivateClean: Data Cleaning and Differential Privacy.,2016,SIGMOD,Data Integration,Data Processing,data cleaning,2015-2019
sigmod_2016_0061,PrivateClean: Data Cleaning and Differential Privacy.,2016,SIGMOD,Privacy / Security,Trust,privacy,2015-2019
sigmod_2016_0062,Publishing Attributed Social Graphs with Formal Privacy Guarantees.,2016,SIGMOD,Graph Data,Data Models,graph,2015-2019
sigmod_2016_0062,Publishing Attributed Social Graphs with Formal Privacy Guarantees.,2016,SIGMOD,Privacy / Security,Trust,privacy,2015-2019
sigmod_2016_0064,QUEPA: QUerying and Exploring a Polystore by Augmentation.,2016,SIGMOD,Query Optimization,Query Processing,querying,2015-2019
sigmod_2016_0065,Query Planning for Evaluating SPARQL Property Paths.,2016,SIGMOD,RDF / Semantic Web,Data Models,sparql,2015-2019
sigmod_2016_0066,REACT: Context-Sensitive Recommendations for Data Analysis.,2016,SIGMOD,Data Analytics,Applications,analysis,2015-2019
sigmod_2016_0069,Rheem: Enabling Multi-Platform Task Execution.,2016,SIGMOD,Query Optimization,Query Processing,execution,2015-2019
sigmod_2016_0070,"SQL Schema Design: Foundations, Normal Forms, and Normalization.",2016,SIGMOD,Query Optimization,Query Processing,sql,2015-2019
sigmod_2016_0072,Scalable Pattern Sharing on Event Streams.,2016,SIGMOD,Streaming,Data Processing,stream,2015-2019
sigmod_2016_0074,Scaling Multicore Databases via Constrained Parallel Execution.,2016,SIGMOD,Query Optimization,Query Processing,execution,2015-2019
sigmod_2016_0074,Scaling Multicore Databases via Constrained Parallel Execution.,2016,SIGMOD,Distributed DB,Systems,parallel,2015-2019
sigmod_2016_0075,Semantic big data for tax assessment.,2016,SIGMOD,Data Analytics,Applications,big data,2015-2019
sigmod_2016_0076,Simba: Efficient In-Memory Spatial Analytics.,2016,SIGMOD,Indexing,Storage & Access,in-memory,2015-2019
sigmod_2016_0076,Simba: Efficient In-Memory Spatial Analytics.,2016,SIGMOD,Data Analytics,Applications,analytics,2015-2019
sigmod_2016_0076,Simba: Efficient In-Memory Spatial Analytics.,2016,SIGMOD,Spatial / Temporal,Specialized Data,spatial,2015-2019
sigmod_2016_0077,Similarity Join over Array Data.,2016,SIGMOD,Query Optimization,Query Processing,join,2015-2019
sigmod_2016_0078,SparkR: Scaling R Programs with Spark.,2016,SIGMOD,Distributed DB,Systems,spark,2015-2019
sigmod_2016_0079,Speedup Graph Processing by Graph Ordering.,2016,SIGMOD,Graph Data,Data Models,graph,2015-2019
sigmod_2016_0080,Stop-and-Stare: Optimal Sampling Algorithms for Viral Marketing in Billion-scale Networks.,2016,SIGMOD,ML for DB,AI for Data Systems,sampling,2015-2019
sigmod_2016_0081,Streaming Algorithms for Robust Distinct Elements.,2016,SIGMOD,Streaming,Data Processing,streaming,2015-2019
sigmod_2016_0082,Temporal Data Exchange.,2016,SIGMOD,Spatial / Temporal,Specialized Data,temporal,2015-2019
sigmod_2016_0083,The case for interactive data exploration accelerators (IDEAs).,2016,SIGMOD,Data Analytics,Applications,interactive,2015-2019
sigmod_2016_0084,TicToc: Time Traveling Optimistic Concurrency Control.,2016,SIGMOD,Transactions,Systems,concurrency control,2015-2019
sigmod_2016_0085,Tornado: A System For Real-Time Iterative Analysis Over Evolving Data.,2016,SIGMOD,Data Analytics,Applications,analysis,2015-2019
sigmod_2016_0086,Towards Best Region Search for Data Exploration.,2016,SIGMOD,Information Retrieval,Applications,search,2015-2019
sigmod_2016_0087,Towards a Non-2PC Transaction Management in Distributed Database Systems.,2016,SIGMOD,Transactions,Systems,transaction,2015-2019
sigmod_2016_0087,Towards a Non-2PC Transaction Management in Distributed Database Systems.,2016,SIGMOD,Distributed DB,Systems,distributed database,2015-2019
sigmod_2016_0089,Towards large-scale data discovery: position paper.,2016,SIGMOD,Data Analytics,Applications,large-scale,2015-2019
sigmod_2016_0090,Truss Decomposition of Probabilistic Graphs: Semantics and Algorithms.,2016,SIGMOD,Graph Data,Data Models,graph,2015-2019
sigmod_2016_0090,Truss Decomposition of Probabilistic Graphs: Semantics and Algorithms.,2016,SIGMOD,ML for DB,AI for Data Systems,probabilistic,2015-2019
sigmod_2016_0091,UpBit: Scalable In-Memory Updatable Bitmap Indexing.,2016,SIGMOD,Indexing,Storage & Access,indexing,2015-2019
sigmod_2016_0092,Utilizing semantic big data for realizing a national-scale infrastructure vulnerability analysis system.,2016,SIGMOD,Data Analytics,Applications,analysis,2015-2019
sigmod_2016_0095,Web-based Benchmarks for Forecasting Systems: The ECAST Platform.,2016,SIGMOD,Data Analytics,Applications,benchmark,2015-2019
sigmod_2017_0001,A Demonstration of Interactive Analysis of Performance Measurements with Viska.,2017,SIGMOD,Data Analytics,Applications,analysis,2015-2019
sigmod_2017_0002,A Demonstration of Lusail: Querying Linked Data at Scale.,2017,SIGMOD,Query Optimization,Query Processing,querying,2015-2019
sigmod_2017_0004,A Top-Down Approach to Achieving Performance Predictability in Database Systems.,2017,SIGMOD,Data Analytics,Applications,performance,2015-2019
sigmod_2017_0005,A large-scale spatio-temporal data analytics system for wildfire risk management.,2017,SIGMOD,Data Analytics,Applications,analytics,2015-2019
sigmod_2017_0005,A large-scale spatio-temporal data analytics system for wildfire risk management.,2017,SIGMOD,Spatial / Temporal,Specialized Data,spatio-temporal,2015-2019
sigmod_2017_0006,ACIDRain: Concurrency-Related Attacks on Database-Backed Web Applications.,2017,SIGMOD,Information Retrieval,Applications,web,2015-2019
sigmod_2017_0009,An Overreaction to the Broken Machine Learning Abstraction: The ease.ml Vision.,2017,SIGMOD,ML for DB,AI for Data Systems,machine learning,2015-2019
sigmod_2017_0010,Approximate Query Processing for Interactive Data Science.,2017,SIGMOD,Query Optimization,Query Processing,query processing,2015-2019
sigmod_2017_0010,Approximate Query Processing for Interactive Data Science.,2017,SIGMOD,Data Analytics,Applications,interactive,2015-2019
sigmod_2017_0011,Approximate Query Processing: No Silver Bullet.,2017,SIGMOD,Query Optimization,Query Processing,query processing,2015-2019
sigmod_2017_0013,BatchDB: Efficient Isolated Execution of Hybrid OLTP+OLAP Workloads for Interactive Applications.,2017,SIGMOD,Query Optimization,Query Processing,execution,2015-2019
sigmod_2017_0013,BatchDB: Efficient Isolated Execution of Hybrid OLTP+OLAP Workloads for Interactive Applications.,2017,SIGMOD,Data Analytics,Applications,workload,2015-2019
sigmod_2017_0015,Controlling False Discoveries During Interactive Data Exploration.,2017,SIGMOD,Data Analytics,Applications,interactive,2015-2019
sigmod_2017_0016,CrowdDQS: Dynamic Question Selection in Crowdsourcing Systems.,2017,SIGMOD,Crowdsourcing,Applications,crowdsourcing,2015-2019
sigmod_2017_0019,Data Management Challenges in Production Machine Learning.,2017,SIGMOD,ML for DB,AI for Data Systems,machine learning,2015-2019
sigmod_2017_0021,Debugging Big Data Analytics in Spark with BigDebug.,2017,SIGMOD,Distributed DB,Systems,spark,2015-2019
sigmod_2017_0021,Debugging Big Data Analytics in Spark with BigDebug.,2017,SIGMOD,Data Analytics,Applications,analytics,2015-2019
sigmod_2017_0022,Debunking the Myths of Influence Maximization: An In-Depth Benchmarking Study.,2017,SIGMOD,Graph Data,Data Models,influence maximization,2015-2019
sigmod_2017_0022,Debunking the Myths of Influence Maximization: An In-Depth Benchmarking Study.,2017,SIGMOD,Data Analytics,Applications,benchmarking,2015-2019
sigmod_2017_0024,Differential Privacy in the Wild: A Tutorial on Current Practices & Open Challenges.,2017,SIGMOD,Privacy / Security,Trust,privacy,2015-2019
sigmod_2017_0025,Enabling Signal Processing over Data Streams.,2017,SIGMOD,Streaming,Data Processing,stream,2015-2019
sigmod_2017_0026,Extracting Knowledge Graphs from Financial Filings: Extended Abstract.,2017,SIGMOD,RDF / Semantic Web,Data Models,knowledge graph,2015-2019
sigmod_2017_0026,Extracting Knowledge Graphs from Financial Filings: Extended Abstract.,2017,SIGMOD,Graph Data,Data Models,graph,2015-2019
sigmod_2017_0027,Extracting Top-K Insights from Multi-dimensional Data.,2017,SIGMOD,Information Retrieval,Applications,top-k,2015-2019
sigmod_2017_0028,Extracting and Analyzing Hidden Graphs from Relational Databases.,2017,SIGMOD,Graph Data,Data Models,graph,2015-2019
sigmod_2017_0029,Extracting visited points of interest from vehicle trajectories.,2017,SIGMOD,Spatial / Temporal,Specialized Data,trajectory,2015-2019
sigmod_2017_0030,FPGA-based Data Partitioning.,2017,SIGMOD,Distributed DB,Systems,partitioning,2015-2019
sigmod_2017_0031,Fast Failure Recovery for Main-Memory DBMSs on Multicores.,2017,SIGMOD,Indexing,Storage & Access,in-memory,2015-2019
sigmod_2017_0031,Fast Failure Recovery for Main-Memory DBMSs on Multicores.,2017,SIGMOD,Transactions,Systems,recovery,2015-2019
sigmod_2017_0032,Flexible and Feasible Support Measures for Mining Frequent Patterns in Large Labeled Graphs.,2017,SIGMOD,Graph Data,Data Models,graph,2015-2019
sigmod_2017_0034,Graph Data Mining with Arabesque.,2017,SIGMOD,Graph Data,Data Models,graph,2015-2019
sigmod_2017_0035,Graph Exploration: From Users to Large Graphs.,2017,SIGMOD,Graph Data,Data Models,graph,2015-2019
sigmod_2017_0036,Heterogeneity-aware Distributed Parameter Servers.,2017,SIGMOD,Distributed DB,Systems,distributed,2015-2019
sigmod_2017_0037,Hybrid Transactional/Analytical Processing: A Survey.,2017,SIGMOD,Query Optimization,Query Processing,analytical processing,2015-2019
sigmod_2017_0039,Interactive Mapping Specification with Exemplar Tuples.,2017,SIGMOD,Data Analytics,Applications,interactive,2015-2019
sigmod_2017_0040,Interactive Query Synthesis from Input-Output Examples.,2017,SIGMOD,Data Analytics,Applications,interactive,2015-2019
sigmod_2017_0041,Interactive Time Series Analytics Powered by ONEX.,2017,SIGMOD,Data Analytics,Applications,analytics,2015-2019
sigmod_2017_0041,Interactive Time Series Analytics Powered by ONEX.,2017,SIGMOD,Spatial / Temporal,Specialized Data,time series,2015-2019
sigmod_2017_0044,Living in Parallel Realities: Co-Existing Schema Versions with a Bidirectional Database Evolution Language.,2017,SIGMOD,Distributed DB,Systems,parallel,2015-2019
sigmod_2017_0046,Massively Parallel Processing of Whole Genome Sequence Data: An In-Depth Performance Study.,2017,SIGMOD,Distributed DB,Systems,parallel,2015-2019
sigmod_2017_0046,Massively Parallel Processing of Whole Genome Sequence Data: An In-Depth Performance Study.,2017,SIGMOD,Data Analytics,Applications,performance,2015-2019
sigmod_2017_0050,Optimizing Data-Intensive Applications Automatically By Leveraging Parallel Data Processing Frameworks.,2017,SIGMOD,Distributed DB,Systems,parallel,2015-2019
sigmod_2017_0053,Pufferfish Privacy Mechanisms for Correlated Data.,2017,SIGMOD,Privacy / Security,Trust,privacy,2015-2019
sigmod_2017_0054,Querying and Exploring Polygamous Relationships in Urban Spatio-Temporal Data Sets.,2017,SIGMOD,Query Optimization,Query Processing,querying,2015-2019
sigmod_2017_0054,Querying and Exploring Polygamous Relationships in Urban Spatio-Temporal Data Sets.,2017,SIGMOD,Spatial / Temporal,Specialized Data,spatio-temporal,2015-2019
sigmod_2017_0055,Repairing Noisy Graphs.,2017,SIGMOD,Graph Data,Data Models,graph,2015-2019
sigmod_2017_0056,SLiMFast: Guaranteed Results for Data Fusion and Source Reliability.,2017,SIGMOD,Data Integration,Data Processing,data fusion,2015-2019
sigmod_2017_0057,Safety check: a semantic web application for emergency management.,2017,SIGMOD,RDF / Semantic Web,Data Models,semantic web,2015-2019
sigmod_2017_0057,Safety check: a semantic web application for emergency management.,2017,SIGMOD,Information Retrieval,Applications,web,2015-2019
sigmod_2017_0060,Schema Independent Relational Learning.,2017,SIGMOD,ML for DB,AI for Data Systems,learning,2015-2019
sigmod_2017_0061,Scout: A GPU-Aware System for Interactive Spatio-temporal Data Visualization.,2017,SIGMOD,Data Analytics,Applications,interactive,2015-2019
sigmod_2017_0061,Scout: A GPU-Aware System for Interactive Spatio-temporal Data Visualization.,2017,SIGMOD,Spatial / Temporal,Specialized Data,spatio-temporal,2015-2019
sigmod_2017_0062,Snorkel: Fast Training Set Generation for Information Extraction.,2017,SIGMOD,Data Integration,Data Processing,information extraction,2015-2019
sigmod_2017_0063,Solving the Join Ordering Problem via Mixed Integer Linear Programming.,2017,SIGMOD,Query Optimization,Query Processing,join order,2015-2019
sigmod_2017_0064,Spatio-temporal prediction of social connections.,2017,SIGMOD,Spatial / Temporal,Specialized Data,spatio-temporal,2015-2019
sigmod_2017_0065,Staging User Feedback toward Rapid Conflict Resolution in Data Fusion.,2017,SIGMOD,Data Integration,Data Processing,data fusion,2015-2019
sigmod_2017_0066,Supervised typing of big graphs using semantic embeddings.,2017,SIGMOD,Graph Data,Data Models,graph,2015-2019
sigmod_2017_0069,Towards Automatically Setting Language Bias in Relational Learning.,2017,SIGMOD,ML for DB,AI for Data Systems,learning,2015-2019
sigmod_2017_0071,Towards minimal algorithms for big data analytics with spreadsheets.,2017,SIGMOD,Data Analytics,Applications,analytics,2015-2019
sigmod_2017_0072,TrillionG: A Trillion-scale Synthetic Graph Generator using a Recursive Vector Model.,2017,SIGMOD,Graph Data,Data Models,graph,2015-2019
sigmod_2017_0075,Visual Graph Query Construction and Refinement.,2017,SIGMOD,Graph Data,Data Models,graph,2015-2019
sigmod_2017_0076,Waldo: An Adaptive Human Interface for Crowd Entity Resolution.,2017,SIGMOD,Data Integration,Data Processing,entity resolution,2015-2019
sigmod_2017_0076,Waldo: An Adaptive Human Interface for Crowd Entity Resolution.,2017,SIGMOD,Crowdsourcing,Applications,crowd,2015-2019
sigmod_2017_0077,Web and Social Media Analytics towards Enhancing Urban Transportations: A Case for Bangalore.,2017,SIGMOD,Data Analytics,Applications,analytics,2015-2019
sigmod_2017_0077,Web and Social Media Analytics towards Enhancing Urban Transportations: A Case for Bangalore.,2017,SIGMOD,Information Retrieval,Applications,social media,2015-2019
sigmod_2018_0002,A Graph Database for a Virtualized Network Infrastructure.,2018,SIGMOD,Graph Data,Data Models,graph,2015-2019
sigmod_2018_0003,A Rating-Ranking Method for Crowdsourced Top-k Computation.,2018,SIGMOD,Information Retrieval,Applications,top-k,2015-2019
sigmod_2018_0004,Accelerating Human-in-the-loop Machine Learning: Challenges and Opportunities.,2018,SIGMOD,ML for DB,AI for Data Systems,machine learning,2015-2019
sigmod_2018_0004,Accelerating Human-in-the-loop Machine Learning: Challenges and Opportunities.,2018,SIGMOD,Crowdsourcing,Applications,human-in-the-loop,2015-2019
sigmod_2018_0005,Adaptive Asynchronous Parallelization of Graph Algorithms.,2018,SIGMOD,Graph Data,Data Models,graph,2015-2019
sigmod_2018_0006,Adaptive Energy-Control for In-Memory Database Systems.,2018,SIGMOD,Indexing,Storage & Access,in-memory,2015-2019
sigmod_2018_0007,Adaptive Optimization of Very Large Join Queries.,2018,SIGMOD,Query Optimization,Query Processing,join,2015-2019
sigmod_2018_0009,"Amazon Aurora: On Avoiding Distributed Consensus for I/Os, Commits, and Membership Changes.",2018,SIGMOD,Distributed DB,Systems,distributed,2015-2019
sigmod_2018_0010,An Ontology of Ownership and Control Relations for Bank Holding Companies.,2018,SIGMOD,RDF / Semantic Web,Data Models,ontology,2015-2019
sigmod_2018_0011,Apache Calcite: A Foundational Framework for Optimized Query Processing Over Heterogeneous Data Sources.,2018,SIGMOD,Query Optimization,Query Processing,query processing,2015-2019
sigmod_2018_0012,Applying Spatial Database Techniques to Other Domains: a Case Study on Top-k and Computational Geometric Operators.,2018,SIGMOD,Information Retrieval,Applications,top-k,2015-2019
sigmod_2018_0012,Applying Spatial Database Techniques to Other Domains: a Case Study on Top-k and Computational Geometric Operators.,2018,SIGMOD,Spatial / Temporal,Specialized Data,spatial,2015-2019
sigmod_2018_0013,Automatic Caching Decision for Scientific Dataflow Execution in Apache Spark.,2018,SIGMOD,Query Optimization,Query Processing,execution,2015-2019
sigmod_2018_0013,Automatic Caching Decision for Scientific Dataflow Execution in Apache Spark.,2018,SIGMOD,Distributed DB,Systems,spark,2015-2019
sigmod_2018_0014,Avatar: Large Scale Entity Resolution of Heterogeneous User Profiles.,2018,SIGMOD,Data Integration,Data Processing,entity resolution,2015-2019
sigmod_2018_0015,Big Data Linkage for Product Specification Pages.,2018,SIGMOD,Data Analytics,Applications,big data,2015-2019
sigmod_2018_0016,Catching Numeric Inconsistencies in Graphs.,2018,SIGMOD,Graph Data,Data Models,graph,2015-2019
sigmod_2018_0018,Cohort Analysis with Ease.,2018,SIGMOD,Data Analytics,Applications,analysis,2015-2019
sigmod_2018_0019,Cold Filter: A Meta-Framework for Faster and More Accurate Stream Processing.,2018,SIGMOD,Streaming,Data Processing,stream,2015-2019
sigmod_2018_0020,Column Sketches: A Scan Accelerator for Rapid and Robust Predicate Evaluation.,2018,SIGMOD,Data Analytics,Applications,evaluation,2015-2019
sigmod_2018_0022,Community Detection in Financial Entities: An Extended Abstract.,2018,SIGMOD,Graph Data,Data Models,community detection,2015-2019
sigmod_2018_0022,Community Detection in Financial Entities: An Extended Abstract.,2018,SIGMOD,ML for DB,AI for Data Systems,detection,2015-2019
sigmod_2018_0025,Data Fusion of Diverse Data Sources: Enrich Spatial Data Knowledge Using HINs.,2018,SIGMOD,Data Integration,Data Processing,data fusion,2015-2019
sigmod_2018_0025,Data Fusion of Diverse Data Sources: Enrich Spatial Data Knowledge Using HINs.,2018,SIGMOD,Spatial / Temporal,Specialized Data,spatial,2015-2019
sigmod_2018_0026,Data Integration and Machine Learning: A Natural Synergy.,2018,SIGMOD,Data Integration,Data Processing,data integration,2015-2019
sigmod_2018_0026,Data Integration and Machine Learning: A Natural Synergy.,2018,SIGMOD,ML for DB,AI for Data Systems,machine learning,2015-2019
sigmod_2018_0028,Deep Reinforcement-Learning Framework for Exploratory Data Analysis.,2018,SIGMOD,Data Analytics,Applications,analysis,2015-2019
sigmod_2018_0030,Density-based Multimodal Spatial Clustering using Pre-trained Deep Network for Extracting Local Topics.,2018,SIGMOD,ML for DB,AI for Data Systems,clustering,2015-2019
sigmod_2018_0030,Density-based Multimodal Spatial Clustering using Pre-trained Deep Network for Extracting Local Topics.,2018,SIGMOD,Spatial / Temporal,Specialized Data,spatial,2015-2019
sigmod_2018_0034,Energy-Utility Function-Based Resource Control for In-Memory Database Systems LIVE.,2018,SIGMOD,Indexing,Storage & Access,in-memory,2015-2019
sigmod_2018_0035,Evaluating Visual Data Analysis Systems: A Discussion Report.,2018,SIGMOD,Data Analytics,Applications,analysis,2015-2019
sigmod_2018_0037,Extending Apache Spark with a Mediation Layer.,2018,SIGMOD,Distributed DB,Systems,spark,2015-2019
sigmod_2018_0038,FASTER: A Concurrent Key-Value Store with In-Place Updates.,2018,SIGMOD,Distributed DB,Systems,key-value,2015-2019
sigmod_2018_0042,Fine-grained Concept Linking using Neural Networks in Healthcare.,2018,SIGMOD,ML for DB,AI for Data Systems,neural,2015-2019
sigmod_2018_0043,G-CORE: A Core for Future Graph Query Languages.,2018,SIGMOD,Graph Data,Data Models,graph,2015-2019
sigmod_2018_0044,GRFusion: Graphs as First-Class Citizens in Main-Memory Relational Database Systems.,2018,SIGMOD,Indexing,Storage & Access,in-memory,2015-2019
sigmod_2018_0044,GRFusion: Graphs as First-Class Citizens in Main-Memory Relational Database Systems.,2018,SIGMOD,Graph Data,Data Models,graph,2015-2019
sigmod_2018_0045,GridFormation: Towards Self-Driven Online Data Partitioning using Reinforcement Learning.,2018,SIGMOD,Distributed DB,Systems,partitioning,2015-2019
sigmod_2018_0045,GridFormation: Towards Self-Driven Online Data Partitioning using Reinforcement Learning.,2018,SIGMOD,ML for DB,AI for Data Systems,learning,2015-2019
